,Headline,Source,Sentiment,Positive_score,Neutral_score,Negative_score,Key_words
134,Turkey opposition candidate visits jailed Kurdish leader,Digital Journal,NEUTRAL,0.011855849996209145,0.9810832142829895,0.00646921107545495,['Turkey opposition candidate']
135,Any new US sanctions on Iran violate resolution 2231,Mehr News Agency - English Version,NEUTRAL,0.008482571691274643,0.9802613258361816,0.010319436900317669,"['Any new US sanctions', 'Iran']"
136,Russians to be able to use rubles in Turkey,vestnik kavkaza,NEUTRAL,0.038801245391368866,0.8713170886039734,0.08184530586004257,"['Russians', 'rubles']"
137,"US will lose after opting out of Iran nuclear deal, ErdoÙan says",Daily Sabah,NEUTRAL,0.006626756861805916,0.8639229536056519,0.12313395738601685,"['Iran nuclear deal', 'Erdo\x80Ùan']"
138,ErdoÙan says 'US will be the one to lose' in quitting Iran deal,Yeni _afak English,NEUTRAL,0.009596165269613266,0.8316610455513,0.15184631943702698,"['Erdo\x80Ùan', 'the one']"
139,Turkey: US decision on Iran deal to cause instability,Brinkwire (press release),NEUTRAL,0.007105197757482529,0.9610958695411682,0.029168693348765373,"['Turkey', 'US decision', 'Iran deal']"
140,US First Side to Lose after Iran Deal Withdrawal: Erdogan,IFP News,NEUTRAL,0.007334497291594744,0.9207446575164795,0.06666537374258041,"['US First Side', 'Iran Deal Withdrawal']"
141,"Iran, Russia and Turkey isolate US in planning Syria's future",MTL News,NEUTRAL,0.029910102486610413,0.9102061986923218,0.055032409727573395,"['Iran', 'Russia and Turkey', 'Syria']"
142,Turkish President to Visit UK,The Speaker,NEUTRAL,0.005547740962356329,0.9736737012863159,0.0196980033069849,['Turkish President']
143,Merkel stresses Germany's support for Iran nuclear deal,ClickLancashire,NEUTRAL,0.005426754709333181,0.9680808186531067,0.02525852620601654,"['Merkel', 'Germany', 'support']"
144,United States Will 'Lose' Over Iran Deal Pullout - Erdogan,ClickLancashire,NEUTRAL,0.0032557365484535694,0.9282543659210205,0.06639694422483444,"['United States Will', ""'Lose"", 'Iran Deal Pullout']"
145,"ErdoÙan's visit important step to develop cooperation, British envoy says",Daily Sabah,NEUTRAL,0.020817957818508148,0.9670361280441284,0.00994540099054575,"['Erdo\x80Ùan', 'visit important step', 'cooperation', 'British envoy']"
146,Three differences between Turkey's 2014 and 2018 presidential elections,Hurriyet Daily News,NEUTRAL,0.0027595837600529194,0.9925122261047363,0.004408078268170357,"['Three differences', 'Turkey', '2014 and 2018']"
147,Turkish minister calls Ankara-London ties 'special',Anadolu Agency,NEUTRAL,0.012542425654828548,0.9403828382492065,0.043981797993183136,"['Turkish minister', 'Ankara-London ties', ""'special""]"
148,"Yeni Safak: Turkish president slams interest lobby, credit agencies",Focus News,NEUTRAL,0.005552943330258131,0.9404833316802979,0.05124565213918686,"['Yeni Safak', 'Turkish president', 'interest lobby']"
149,"Russia's Putin, Germany's Merkel discuss Iran nuclear deal: Kremlin",The Hans India,NEUTRAL,0.003337279660627246,0.9736734628677368,0.021480007097125053,"['Russia', 'Putin', 'Germany', 'Merkel', 'Iran nuclear deal']"
150,"After Argentina, watch out for Turkey's banks ÛÒ FT",Ahval,NEUTRAL,0.012643687427043915,0.9790880680084229,0.007406786549836397,"['Argentina', 'Turkey', 'banks']"
151,Turkish lira eases against dollar after strong rebound,Nasdaq,NEUTRAL,0.07062989473342896,0.666965126991272,0.21705418825149536,"['Turkish lira', 'dollar']"
152,US will lose from ending Iran deal: Turkey's president,Brinkwire (press release),NEUTRAL,0.007425772491842508,0.774633526802063,0.2078464776277542,"['Iran deal', 'Turkey']"
153,"Putin, Erdogan Agree Trump Was 'Wrong' on Iran Nuclear Deal",teleSUR English,NEUTRAL,0.0053981696255505085,0.8225576281547546,0.1651751697063446,"['Putin', 'Erdogan Agree Trump', 'Wrong']"
154,"Source Reveals Details of Erdogan, Putin Phone Call Over Iran Nuclear Deal",Sputnik International,NEUTRAL,0.004164951853454113,0.9745404124259949,0.019930720329284668,"['Source Reveals Details', 'Erdogan, Putin Phone Call']"
155,"Putin, Erdogan discuss situation over Iranian deal",Information-Analytic Agency NEWS.am,NEUTRAL,0.0070137325674295425,0.9621729850769043,0.029169416055083275,"['Putin', 'Erdogan', 'situation']"
